{
  "candidate": {
    "email": {
      "confidence": 1,
      "evidence": [
        {
          "excerpt": "rowan.brooks@example.com",
          "page": 1,
          "sourceSha256": "0b7a1331cb67435939c6fb8b3446c7c0968f6ef9a85c5c45d666fc9315e64f05"
        }
      ],
      "origin": "extracted",
      "reviewState": "unreviewed",
      "value": "rowan.brooks@example.com",
      "warnings": []
    },
    "fullName": {
      "confidence": 1,
      "evidence": [
        {
          "excerpt": "Rowan Brooks",
          "page": 1,
          "sourceSha256": "0b7a1331cb67435939c6fb8b3446c7c0968f6ef9a85c5c45d666fc9315e64f05"
        }
      ],
      "origin": "extracted",
      "reviewState": "unreviewed",
      "value": "Rowan Brooks",
      "warnings": []
    },
    "headline": {
      "confidence": 1,
      "evidence": [
        {
          "excerpt": "Junior Data Analyst",
          "page": 1,
          "sourceSha256": "0b7a1331cb67435939c6fb8b3446c7c0968f6ef9a85c5c45d666fc9315e64f05"
        }
      ],
      "origin": "extracted",
      "reviewState": "unreviewed",
      "value": "Junior Data Analyst",
      "warnings": []
    },
    "location": {
      "confidence": 1,
      "evidence": [
        {
          "excerpt": "Manchester, United Kingdom",
          "page": 1,
          "sourceSha256": "0b7a1331cb67435939c6fb8b3446c7c0968f6ef9a85c5c45d666fc9315e64f05"
        }
      ],
      "origin": "extracted",
      "reviewState": "unreviewed",
      "value": "Manchester, United Kingdom",
      "warnings": []
    }
  },
  "certifications": [
    {
      "id": "dffaa215-8639-5e85-a04a-c007423a5875",
      "issuedDate": {
        "confidence": 1,
        "evidence": [
          {
            "excerpt": "2025-02",
            "page": 1,
            "sourceSha256": "0b7a1331cb67435939c6fb8b3446c7c0968f6ef9a85c5c45d666fc9315e64f05"
          }
        ],
        "origin": "extracted",
        "precision": "month",
        "reviewState": "unreviewed",
        "value": "2025-02",
        "warnings": []
      },
      "issuer": {
        "confidence": 1,
        "evidence": [
          {
            "excerpt": "Northbridge Learning",
            "page": 1,
            "sourceSha256": "0b7a1331cb67435939c6fb8b3446c7c0968f6ef9a85c5c45d666fc9315e64f05"
          }
        ],
        "origin": "extracted",
        "reviewState": "unreviewed",
        "value": "Northbridge Learning",
        "warnings": []
      },
      "name": {
        "confidence": 1,
        "evidence": [
          {
            "excerpt": "Applied Data Analysis Certificate",
            "page": 1,
            "sourceSha256": "0b7a1331cb67435939c6fb8b3446c7c0968f6ef9a85c5c45d666fc9315e64f05"
          }
        ],
        "origin": "extracted",
        "reviewState": "unreviewed",
        "value": "Applied Data Analysis Certificate",
        "warnings": []
      }
    }
  ],
  "createdAt": "2026-01-01T00:00:00Z",
  "documentId": "5d0a8608-ac3b-5034-b097-33f96a070324",
  "education": [
    {
      "degree": {
        "confidence": 1,
        "evidence": [
          {
            "excerpt": "BSc",
            "page": 1,
            "sourceSha256": "0b7a1331cb67435939c6fb8b3446c7c0968f6ef9a85c5c45d666fc9315e64f05"
          }
        ],
        "origin": "extracted",
        "reviewState": "unreviewed",
        "value": "BSc",
        "warnings": []
      },
      "endDate": {
        "confidence": 1,
        "evidence": [
          {
            "excerpt": "2018",
            "page": 1,
            "sourceSha256": "0b7a1331cb67435939c6fb8b3446c7c0968f6ef9a85c5c45d666fc9315e64f05"
          }
        ],
        "origin": "extracted",
        "precision": "year",
        "reviewState": "unreviewed",
        "value": "2018",
        "warnings": []
      },
      "fieldOfStudy": {
        "confidence": 1,
        "evidence": [
          {
            "excerpt": "Mathematics",
            "page": 1,
            "sourceSha256": "0b7a1331cb67435939c6fb8b3446c7c0968f6ef9a85c5c45d666fc9315e64f05"
          }
        ],
        "origin": "extracted",
        "reviewState": "unreviewed",
        "value": "Mathematics",
        "warnings": []
      },
      "id": "9ff98761-e0c5-5745-a2ae-ae29545d364f",
      "institution": {
        "confidence": 1,
        "evidence": [
          {
            "excerpt": "Moorland University",
            "page": 1,
            "sourceSha256": "0b7a1331cb67435939c6fb8b3446c7c0968f6ef9a85c5c45d666fc9315e64f05"
          }
        ],
        "origin": "extracted",
        "reviewState": "unreviewed",
        "value": "Moorland University",
        "warnings": []
      }
    }
  ],
  "experience": [
    {
      "company": {
        "confidence": 1,
        "evidence": [
          {
            "excerpt": "Riverside Community School",
            "page": 1,
            "sourceSha256": "0b7a1331cb67435939c6fb8b3446c7c0968f6ef9a85c5c45d666fc9315e64f05"
          }
        ],
        "origin": "extracted",
        "reviewState": "unreviewed",
        "value": "Riverside Community School",
        "warnings": []
      },
      "endDate": {
        "confidence": 1,
        "evidence": [
          {
            "excerpt": "Sep 2018 - Aug 2024",
            "page": 1,
            "sourceSha256": "0b7a1331cb67435939c6fb8b3446c7c0968f6ef9a85c5c45d666fc9315e64f05"
          }
        ],
        "origin": "extracted",
        "precision": "month",
        "reviewState": "unreviewed",
        "value": "2024-08",
        "warnings": []
      },
      "highlights": [
        {
          "confidence": 1,
          "evidence": [
            {
              "excerpt": "Analyzed assessment trends for 240 students and presented intervention recommendations.",
              "page": 1,
              "sourceSha256": "0b7a1331cb67435939c6fb8b3446c7c0968f6ef9a85c5c45d666fc9315e64f05"
            }
          ],
          "origin": "extracted",
          "reviewState": "unreviewed",
          "value": "Analyzed assessment trends for 240 students and presented intervention recommendations.",
          "warnings": []
        },
        {
          "confidence": 1,
          "evidence": [
            {
              "excerpt": "Coordinated curriculum planning across a team of seven teachers.",
              "page": 1,
              "sourceSha256": "0b7a1331cb67435939c6fb8b3446c7c0968f6ef9a85c5c45d666fc9315e64f05"
            }
          ],
          "origin": "extracted",
          "reviewState": "unreviewed",
          "value": "Coordinated curriculum planning across a team of seven teachers.",
          "warnings": []
        }
      ],
      "id": "7b60fb5a-940d-56b8-812d-cb62de9ff8f3",
      "isCurrent": {
        "confidence": 1,
        "evidence": [
          {
            "excerpt": "Sep 2018 - Aug 2024",
            "page": 1,
            "sourceSha256": "0b7a1331cb67435939c6fb8b3446c7c0968f6ef9a85c5c45d666fc9315e64f05"
          }
        ],
        "origin": "extracted",
        "reviewState": "unreviewed",
        "value": false,
        "warnings": []
      },
      "startDate": {
        "confidence": 1,
        "evidence": [
          {
            "excerpt": "Sep 2018 - Aug 2024",
            "page": 1,
            "sourceSha256": "0b7a1331cb67435939c6fb8b3446c7c0968f6ef9a85c5c45d666fc9315e64f05"
          }
        ],
        "origin": "extracted",
        "precision": "month",
        "reviewState": "unreviewed",
        "value": "2018-09",
        "warnings": []
      },
      "title": {
        "confidence": 1,
        "evidence": [
          {
            "excerpt": "Mathematics Teacher",
            "page": 1,
            "sourceSha256": "0b7a1331cb67435939c6fb8b3446c7c0968f6ef9a85c5c45d666fc9315e64f05"
          }
        ],
        "origin": "extracted",
        "reviewState": "unreviewed",
        "value": "Mathematics Teacher",
        "warnings": []
      }
    }
  ],
  "languages": [
    {
      "id": "5c355d64-69e0-5c39-9dde-6cb2ab42d57e",
      "name": {
        "confidence": 1,
        "evidence": [
          {
            "excerpt": "English",
            "page": 1,
            "sourceSha256": "0b7a1331cb67435939c6fb8b3446c7c0968f6ef9a85c5c45d666fc9315e64f05"
          }
        ],
        "origin": "extracted",
        "reviewState": "unreviewed",
        "value": "English",
        "warnings": []
      },
      "proficiency": {
        "confidence": 1,
        "evidence": [
          {
            "excerpt": "Native",
            "page": 1,
            "sourceSha256": "0b7a1331cb67435939c6fb8b3446c7c0968f6ef9a85c5c45d666fc9315e64f05"
          }
        ],
        "origin": "extracted",
        "reviewState": "unreviewed",
        "value": "Native",
        "warnings": []
      }
    }
  ],
  "links": [
    {
      "id": "b856f81d-704d-5a10-bc8b-b9036982cdd8",
      "label": {
        "confidence": 1,
        "evidence": [
          {
            "excerpt": "Data portfolio",
            "page": 1,
            "sourceSha256": "0b7a1331cb67435939c6fb8b3446c7c0968f6ef9a85c5c45d666fc9315e64f05"
          }
        ],
        "origin": "extracted",
        "reviewState": "unreviewed",
        "value": "Data portfolio",
        "warnings": []
      },
      "url": {
        "confidence": 1,
        "evidence": [
          {
            "excerpt": "https://example.com/rowan-brooks",
            "page": 1,
            "sourceSha256": "0b7a1331cb67435939c6fb8b3446c7c0968f6ef9a85c5c45d666fc9315e64f05"
          }
        ],
        "origin": "extracted",
        "reviewState": "unreviewed",
        "value": "https://example.com/rowan-brooks",
        "warnings": []
      }
    }
  ],
  "projects": [
    {
      "description": {
        "confidence": 1,
        "evidence": [
          {
            "excerpt": "Cleaned public transport data and built an interactive delay dashboard.",
            "page": 1,
            "sourceSha256": "0b7a1331cb67435939c6fb8b3446c7c0968f6ef9a85c5c45d666fc9315e64f05"
          }
        ],